vllm/model_executor/layers/fused_moe/configs/E=8,N=4096,device_name=NVIDIA_B200,dtype=bfloat16.json
{
  "1": {
    "BLOCK_SIZE_M": 64,
    "BLOCK_SIZE_N": 64,
    "BLOCK_SIZE_K": 32,
    "GROUP_SIZE_M": 1,
    "num_warps": 4,
    "num_stages": 4,
    "SPLIT_K": 1
  },
  "2": {
    "BLOCK_SIZE_M": 64,
    "BLOCK_SIZE_N": 64,
    "BLOCK_SIZE_K": 64,
    "GROUP_SIZE_M": 1,
    "num_warps": 8,
    "num_stages": 3,
    "SPLIT_K": 1
  },
  "4": {
    "BLOCK_SIZE_M": 128,
    "BLOCK_SIZE_N": 64,
    "BLOCK_SIZE_K": 32,
    "GROUP_SIZE_M": 16,
    "num_warps": 4,
    "num_stages": 2,
    "SPLIT_K": 1
  },
  "8": {
    "BLOCK_SIZE_M": 16,
    "BLOCK_SIZE_N": 32,
    "BLOCK_SIZE_K": 32,
    "GROUP_SIZE_M": 8,
    "num_warps": 4,
    "num_stages": 3,
    "SPLIT_K": 1
  },
  "16": {
    "BLOCK_SIZE_M": 16,
    "BLOCK_SIZE_N": 128,
    "BLOCK_SIZE_K": 64,
    "GROUP_SIZE_M": 16,
    "num_warps": 4,
    "num_stages": 4,
    "SPLIT_K": 1
  },
  "32": {
    "BLOCK_SIZE_M": 16,
    "BLOCK_SIZE_N": 128,
    "BLOCK_SIZE_K": 64,
    "GROUP_SIZE_M": 8,
    "num_warps": 4,
    "num_stages": 2,
    "SPLIT_K": 1
  },
  "64": {
    "BLOCK_SIZE_M": 16,
    "BLOCK_SIZE_N": 128,
    "BLOCK_SIZE_K": 32,
    "GROUP_SIZE_M": 1,
    "num_warps": 4,
    "num_stages": 3,
    "SPLIT_K": 1
  },
  "128": {
    "BLOCK_SIZE_M": 16,
    "BLOCK_SIZE_N": 128,
    "BLOCK_SIZE_K": 32,
    "GROUP_SIZE_M": 8,
    "num_warps": 4,
    "num_stages": 4,
    "SPLIT_K": 1
  },
  "256": {
    "BLOCK_SIZE_M": 16,
    "BLOCK_SIZE_N": 128,
    "BLOCK_SIZE_K": 32,
    "GROUP_SIZE_M": 1,
    "num_warps": 4,
    "num_stages": 4,
    "SPLIT_K": 1
  },
  "512": {
    "BLOCK_SIZE_M": 16,
    "BLOCK_SIZE_N": 128,
    "BLOCK_SIZE_K": 32,
    "GROUP_SIZE_M": 1,
    "num_warps": 4,
    "num_stages": 4,
    "SPLIT_K": 1
  },
  "1024": {
    "BLOCK_SIZE_M": 16,
    "BLOCK_SIZE_N": 128,
    "BLOCK_SIZE_K": 32,
    "GROUP_SIZE_M": 8,
    "num_warps": 4,
    "num_stages": 4,
    "SPLIT_K": 1
  },
  "4096": {
    "BLOCK_SIZE_M": 16,
    "BLOCK_SIZE_N": 128,
    "BLOCK_SIZE_K": 32,
    "GROUP_SIZE_M": 16,
    "num_warps": 4,
    "num_stages": 3,
    "SPLIT_K": 1
  },
  "65536": {
    "BLOCK_SIZE_M": 16,
    "BLOCK_SIZE_N": 128,
    "BLOCK_SIZE_K": 32,
    "GROUP_SIZE_M": 16,
    "num_warps": 4,
    "num_stages": 2,
    "SPLIT_K": 1
  }
}